{
  "$schema": "./scenario-index.schema.json",
  "format": "siok.scenario-viewer-catalog",
  "formatVersion": 1,
  "generatedAt": "2026-08-12",
  "basePath": "../translations/dialogue/",
  "assets": [
    {
      "name": "scenario_STG0001a.json",
      "key": "STG0001a",
      "label": "STG0001a · scenario_STG0001a.json",
      "scope": "stage",
      "path": "../translations/dialogue/scenario_STG0001a.json",
      "entries": 93
    },
    {
      "name": "scenario_STG0001b.json",
      "key": "STG0001b",
      "label": "STG0001b · scenario_STG0001b.json",
      "scope": "stage",
      "path": "../translations/dialogue/scenario_STG0001b.json",
      "entries": 558
    },
    {
      "name": "scenario_STG0002.json",
      "key": "STG0002",
      "label": "STG0002 · scenario_STG0002.json",
      "scope": "stage",
      "path": "../translations/dialogue/scenario_STG0002.json",
      "entries": 1443
    },
    {
      "name": "scenario_STG0003.json",
      "key": "STG0003",
      "label": "STG0003 · scenario_STG0003.json",
      "scope": "stage",
      "path": "../translations/dialogue/scenario_STG0003.json",
      "entries": 976
    },
    {
      "name": "scenario_STG0004.json",
      "key": "STG0004",
      "label": "STG0004 · scenario_STG0004.json",
      "scope": "stage",
      "path": "../translations/dialogue/scenario_STG0004.json",
      "entries": 1561
    },
    {
      "name": "scenario_STG0005.json",
      "key": "STG0005",
      "label": "STG0005 · scenario_STG0005.json",
      "scope": "stage",
      "path": "../translations/dialogue/scenario_STG0005.json",
      "entries": 1021
    },
    {
      "name": "scenario_STG0006.json",
      "key": "STG0006",
      "label": "STG0006 · scenario_STG0006.json",
      "scope": "stage",
      "path": "../translations/dialogue/scenario_STG0006.json",
      "entries": 888
    },
    {
      "name": "scenario_STG0007a.json",
      "key": "STG0007a",
      "label": "STG0007a · scenario_STG0007a.json",
      "scope": "stage",
      "path": "../translations/dialogue/scenario_STG0007a.json",
      "entries": 141
    },
    {
      "name": "scenario_STG0007b.json",
      "key": "STG0007b",
      "label": "STG0007b · scenario_STG0007b.json",
      "scope": "stage",
      "path": "../translations/dialogue/scenario_STG0007b.json",
      "entries": 993
    },
    {
      "name": "scenario_STG0008.json",
      "key": "STG0008",
      "label": "STG0008 · scenario_STG0008.json",
      "scope": "stage",
      "path": "../translations/dialogue/scenario_STG0008.json",
      "entries": 1105
    },
    {
      "name": "scenario_STG0009.json",
      "key": "STG0009",
      "label": "STG0009 · scenario_STG0009.json",
      "scope": "stage",
      "path": "../translations/dialogue/scenario_STG0009.json",
      "entries": 944
    },
    {
      "name": "scenario_STG0010.json",
      "key": "STG0010",
      "label": "STG0010 · scenario_STG0010.json",
      "scope": "stage",
      "path": "../translations/dialogue/scenario_STG0010.json",
      "entries": 1907
    },
    {
      "name": "scenario_STG0011.json",
      "key": "STG0011",
      "label": "STG0011 · scenario_STG0011.json",
      "scope": "stage",
      "path": "../translations/dialogue/scenario_STG0011.json",
      "entries": 1218
    },
    {
      "name": "scenario_STG0012.json",
      "key": "STG0012",
      "label": "STG0012 · scenario_STG0012.json",
      "scope": "stage",
      "path": "../translations/dialogue/scenario_STG0012.json",
      "entries": 1344
    },
    {
      "name": "scenario_STG0013.json",
      "key": "STG0013",
      "label": "STG0013 · scenario_STG0013.json",
      "scope": "stage",
      "path": "../translations/dialogue/scenario_STG0013.json",
      "entries": 658
    },
    {
      "name": "scenario_STG0014.json",
      "key": "STG0014",
      "label": "STG0014 · scenario_STG0014.json",
      "scope": "stage",
      "path": "../translations/dialogue/scenario_STG0014.json",
      "entries": 1544
    },
    {
      "name": "scenario_STG0015.json",
      "key": "STG0015",
      "label": "STG0015 · scenario_STG0015.json",
      "scope": "stage",
      "path": "../translations/dialogue/scenario_STG0015.json",
      "entries": 1148
    },
    {
      "name": "scenario_STG0016.json",
      "key": "STG0016",
      "label": "STG0016 · scenario_STG0016.json",
      "scope": "stage",
      "path": "../translations/dialogue/scenario_STG0016.json",
      "entries": 1449
    },
    {
      "name": "scenario_STG0017.json",
      "key": "STG0017",
      "label": "STG0017 · scenario_STG0017.json",
      "scope": "stage",
      "path": "../translations/dialogue/scenario_STG0017.json",
      "entries": 1035
    },
    {
      "name": "scenario_STG0018.json",
      "key": "STG0018",
      "label": "STG0018 · scenario_STG0018.json",
      "scope": "stage",
      "path": "../translations/dialogue/scenario_STG0018.json",
      "entries": 1416
    },
    {
      "name": "scenario_STG0019.json",
      "key": "STG0019",
      "label": "STG0019 · scenario_STG0019.json",
      "scope": "stage",
      "path": "../translations/dialogue/scenario_STG0019.json",
      "entries": 1271
    },
    {
      "name": "scenario_STG0020.json",
      "key": "STG0020",
      "label": "STG0020 · scenario_STG0020.json",
      "scope": "stage",
      "path": "../translations/dialogue/scenario_STG0020.json",
      "entries": 988
    },
    {
      "name": "scenario_STG0021.json",
      "key": "STG0021",
      "label": "STG0021 · scenario_STG0021.json",
      "scope": "stage",
      "path": "../translations/dialogue/scenario_STG0021.json",
      "entries": 1195
    },
    {
      "name": "scenario_STG0022.json",
      "key": "STG0022",
      "label": "STG0022 · scenario_STG0022.json",
      "scope": "stage",
      "path": "../translations/dialogue/scenario_STG0022.json",
      "entries": 993
    },
    {
      "name": "scenario_STG0023.json",
      "key": "STG0023",
      "label": "STG0023 · scenario_STG0023.json",
      "scope": "stage",
      "path": "../translations/dialogue/scenario_STG0023.json",
      "entries": 1029
    },
    {
      "name": "scenario_STG0024.json",
      "key": "STG0024",
      "label": "STG0024 · scenario_STG0024.json",
      "scope": "stage",
      "path": "../translations/dialogue/scenario_STG0024.json",
      "entries": 1147
    },
    {
      "name": "scenario_STG0025.json",
      "key": "STG0025",
      "label": "STG0025 · scenario_STG0025.json",
      "scope": "stage",
      "path": "../translations/dialogue/scenario_STG0025.json",
      "entries": 2915
    },
    {
      "name": "scenario_STG0026.json",
      "key": "STG0026",
      "label": "STG0026 · scenario_STG0026.json",
      "scope": "stage",
      "path": "../translations/dialogue/scenario_STG0026.json",
      "entries": 1204
    },
    {
      "name": "scenario_STG0027.json",
      "key": "STG0027",
      "label": "STG0027 · scenario_STG0027.json",
      "scope": "stage",
      "path": "../translations/dialogue/scenario_STG0027.json",
      "entries": 2443
    },
    {
      "name": "scenario_STG0028.json",
      "key": "STG0028",
      "label": "STG0028 · scenario_STG0028.json",
      "scope": "stage",
      "path": "../translations/dialogue/scenario_STG0028.json",
      "entries": 1583
    },
    {
      "name": "scenario_STG0029.json",
      "key": "STG0029",
      "label": "STG0029 · scenario_STG0029.json",
      "scope": "stage",
      "path": "../translations/dialogue/scenario_STG0029.json",
      "entries": 1527
    },
    {
      "name": "scenario_STG0030.json",
      "key": "STG0030",
      "label": "STG0030 · scenario_STG0030.json",
      "scope": "stage",
      "path": "../translations/dialogue/scenario_STG0030.json",
      "entries": 1161
    },
    {
      "name": "scenario_STG0031a.json",
      "key": "STG0031a",
      "label": "STG0031a · scenario_STG0031a.json",
      "scope": "stage",
      "path": "../translations/dialogue/scenario_STG0031a.json",
      "entries": 327
    },
    {
      "name": "scenario_STG0031b.json",
      "key": "STG0031b",
      "label": "STG0031b · scenario_STG0031b.json",
      "scope": "stage",
      "path": "../translations/dialogue/scenario_STG0031b.json",
      "entries": 1764
    },
    {
      "name": "scenario_STG0032.json",
      "key": "STG0032",
      "label": "STG0032 · scenario_STG0032.json",
      "scope": "stage",
      "path": "../translations/dialogue/scenario_STG0032.json",
      "entries": 2122
    },
    {
      "name": "scenario_STG0033a.json",
      "key": "STG0033a",
      "label": "STG0033a · scenario_STG0033a.json",
      "scope": "stage",
      "path": "../translations/dialogue/scenario_STG0033a.json",
      "entries": 768
    },
    {
      "name": "scenario_STG0033b.json",
      "key": "STG0033b",
      "label": "STG0033b · scenario_STG0033b.json",
      "scope": "stage",
      "path": "../translations/dialogue/scenario_STG0033b.json",
      "entries": 1139
    },
    {
      "name": "scenario_STG0034.json",
      "key": "STG0034",
      "label": "STG0034 · scenario_STG0034.json",
      "scope": "stage",
      "path": "../translations/dialogue/scenario_STG0034.json",
      "entries": 1075
    },
    {
      "name": "scenario_STG0035.json",
      "key": "STG0035",
      "label": "STG0035 · scenario_STG0035.json",
      "scope": "stage",
      "path": "../translations/dialogue/scenario_STG0035.json",
      "entries": 1183
    },
    {
      "name": "scenario_STG0036.json",
      "key": "STG0036",
      "label": "STG0036 · scenario_STG0036.json",
      "scope": "stage",
      "path": "../translations/dialogue/scenario_STG0036.json",
      "entries": 1174
    },
    {
      "name": "scenario_STG0037.json",
      "key": "STG0037",
      "label": "STG0037 · scenario_STG0037.json",
      "scope": "stage",
      "path": "../translations/dialogue/scenario_STG0037.json",
      "entries": 1397
    },
    {
      "name": "scenario_STG0038.json",
      "key": "STG0038",